{
  "id": "BOSS20240004",
  "title": "数据分析实习生",
  "company": "美团",
  "company_size": "2000人以上",
  "company_industry": "互联网/本地生活",
  "location": "北京",
  "job_type": "实习",
  "salary_min": 5000,
  "salary_max": 7000,
  "salary_months": 15,
  "education": "本科",
  "experience": "应届生",
  "description": "美团外卖业务数据分析团队招聘实习生，负责业务数据分析和数据报告撰写。",
  "requirements": [
    "统计学、数学、计算机等相关专业",
    "熟练使用SQL",
    "熟悉Python或R语言",
    "有数据分析实习经验优先"
  ],
  "skills": ["SQL", "Python", "数据分析", "Excel", "Tableau"],
  "posted_date": "2026-04-10",
  "source": "boss",
  "url": "https://www.zhipin.com/job_detail/xxx",
  "status": "active"
}
