{
  "id": "ZPIN20240005",
  "title": "Python后端开发实习生",
  "company": "小红书",
  "company_size": "500-2000人",
  "company_industry": "互联网/内容社区",
  "location": "上海",
  "job_type": "实习",
  "salary_min": 4500,
  "salary_max": 6500,
  "salary_months": 15,
  "education": "本科",
  "experience": "应届生",
  "description": "小红书社区技术部招聘Python后端实习生，参与社区推荐系统开发。",
  "requirements": [
    "计算机相关专业",
    "熟悉Python编程",
    "了解Django或Flask框架",
    "熟悉MySQL和Redis",
    "了解微服务架构"
  ],
  "skills": ["Python", "Django", "MySQL", "Redis", "微服务"],
  "posted_date": "2026-04-07",
  "source": "zhaopin",
  "url": "https://www.zhaopin.com/job/xxx",
  "status": "active"
}
