{
  "id": "BOSS20240023",
  "title": "DevOps实习生",
  "company": "华为",
  "company_size": "2000人以上",
  "company_industry": "通信/硬件",
  "location": "深圳",
  "job_type": "实习",
  "salary_min": 8500,
  "salary_max": 14000,
  "salary_months": 14,
  "education": "本科",
  "experience": "应届生",
  "description": "华为云DevOps实习生，参与CI/CD流水线建设，负责容器化部署和运维自动化。",
  "requirements": [
    "计算机或相关专业本科",
    "熟悉Linux操作系统",
    "了解Docker/Kubernetes",
    "有脚本编程经验者优先"
  ],
  "skills": ["Docker", "Kubernetes", "Jenkins", "GitLab CI", "Linux", "Shell", "Ansible"],
  "posted_date": "2026-04-09",
  "source": "boss",
  "url": "https://www.zhipin.com/job_detail/xxx",
  "status": "active"
}