{
  "id": "BOSS20240026",
  "title": "人力资源实习生",
  "company": "滴滴出行",
  "company_size": "2000人以上",
  "company_industry": "互联网/出行",
  "location": "北京",
  "job_type": "实习",
  "salary_min": 5000,
  "salary_max": 8000,
  "salary_months": 12,
  "education": "本科",
  "experience": "应届生",
  "description": "滴滴出行人力资源实习生，参与招聘流程支持、员工关系管理和HR系统维护。",
  "requirements": [
    "人力资源管理、心理学、管理学等相关专业",
    "具备良好的沟通和组织能力",
    "熟悉Office办公软件",
    "有HR相关实习经验者优先"
  ],
  "skills": ["招聘", "员工关系", "HR系统", "沟通能力", "组织协调", "Office"],
  "posted_date": "2026-04-06",
  "source": "boss",
  "url": "https://www.zhipin.com/job_detail/xxx",
  "status": "active"
}