{
  "id": "BOSS20240001",
  "title": "Java开发工程师（实习）",
  "company": "阿里巴巴集团",
  "company_size": "2000人以上",
  "company_industry": "互联网/电商",
  "location": "杭州",
  "job_type": "实习",
  "salary_min": 4000,
  "salary_max": 6000,
  "salary_months": 16,
  "education": "本科",
  "experience": "应届生",
  "description": "阿里巴巴2025届实习生招聘，Base杭州。负责电商平台后端开发，参与高并发系统设计。",
  "requirements": [
    "计算机相关专业本科及以上学历",
    "熟悉Java编程语言",
    "了解Spring Boot框架",
    "熟悉MySQL数据库",
    "良好的沟通能力和团队协作精神"
  ],
  "skills": ["Java", "Spring Boot", "MySQL", "Redis", "微服务"],
  "posted_date": "2026-04-10",
  "deadline": "2026-06-30",
  "source": "boss",
  "url": "https://www.zhipin.com/job_detail/xxx",
  "status": "active",
  "created_at": "2026-04-11T10:00:00Z",
  "updated_at": "2026-04-11T10:00:00Z"
}
