{
  "id": "51JOB2024009",
  "title": "测试开发实习生",
  "company": "京东",
  "company_size": "2000人以上",
  "company_industry": "互联网/电商",
  "location": "北京",
  "job_type": "实习",
  "salary_min": 4500,
  "salary_max": 6500,
  "salary_months": 14,
  "education": "本科",
  "experience": "应届生",
  "description": "京东零售技术部招聘测试开发实习生，参与自动化测试平台建设。",
  "requirements": [
    "计算机相关专业",
    "熟悉Python或Java",
    "了解软件测试理论",
    "有自动化测试经验优先"
  ],
  "skills": ["Python", "Selenium", "自动化测试", "接口测试", "Pytest"],
  "posted_date": "2026-04-08",
  "source": "51job",
  "url": "https://www.51job.com/job/xxx",
  "status": "active"
}
