{
  "id": "BOSS20240022",
  "title": "移动端开发实习生",
  "company": "字节跳动",
  "company_size": "2000人以上",
  "company_industry": "互联网/内容",
  "location": "北京",
  "job_type": "实习",
  "salary_min": 10000,
  "salary_max": 18000,
  "salary_months": 15,
  "education": "本科",
  "experience": "应届生",
  "description": "字节跳动抖音团队招聘移动端开发实习生，参与抖音客户端功能开发和性能优化。",
  "requirements": [
    "计算机相关专业本科及以上",
    "熟悉Android/iOS开发",
    "掌握Java/Kotlin或Swift/Objective-C",
    "有移动端项目经验者优先"
  ],
  "skills": ["Android", "iOS", "Kotlin", "Swift", "Flutter", "React Native", "移动端开发"],
  "posted_date": "2026-04-11",
  "source": "boss",
  "url": "https://www.zhipin.com/job_detail/xxx",
  "status": "active"
}