{
  "id": "51JOB2024003",
  "title": "产品经理实习生",
  "company": "字节跳动",
  "company_size": "2000人以上",
  "company_industry": "互联网/内容",
  "location": "北京",
  "job_type": "实习",
  "salary_min": 6000,
  "salary_max": 10000,
  "salary_months": 15,
  "education": "本科",
  "experience": "应届生",
  "description": "抖音产品团队招聘产品经理实习生，参与抖音电商功能的产品设计和迭代。",
  "requirements": [
    "本科及以上学历，专业不限",
    "对互联网产品有热情",
    "良好的逻辑思维和分析能力",
    "优秀的沟通协调能力",
    "有产品相关实习经验优先"
  ],
  "skills": ["需求分析", "原型设计", "数据分析", "用户研究", "PRD文档"],
  "posted_date": "2026-04-09",
  "deadline": "2026-05-15",
  "source": "51job",
  "url": "https://www.51job.com/job/xxx",
  "status": "active",
  "created_at": "2026-04-11T10:00:00Z",
  "updated_at": "2026-04-11T10:00:00Z"
}
