{
  "id": "BOSS20240027",
  "title": "财务实习生",
  "company": "京东",
  "company_size": "2000人以上",
  "company_industry": "互联网/电商",
  "location": "北京",
  "job_type": "实习",
  "salary_min": 5500,
  "salary_max": 9000,
  "salary_months": 12,
  "education": "本科",
  "experience": "应届生",
  "description": "京东财务部实习生，参与财务报表处理、成本分析和预算编制支持工作。",
  "requirements": [
    "会计、财务管理等相关专业",
    "熟悉会计准则和财务软件",
    "具备良好的数据分析能力",
    "有相关实习经验者优先"
  ],
  "skills": ["财务会计", "财务报表", "成本分析", "预算编制", "Excel", "财务软件"],
  "posted_date": "2026-04-05",
  "source": "boss",
  "url": "https://www.zhipin.com/job_detail/xxx",
  "status": "active"
}