{
  "id": "BOSS20240025",
  "title": "市场营销实习生",
  "company": "小红书",
  "company_size": "500-2000人",
  "company_industry": "互联网/社交电商",
  "location": "上海",
  "job_type": "实习",
  "salary_min": 6000,
  "salary_max": 10000,
  "salary_months": 12,
  "education": "本科",
  "experience": "应届生",
  "description": "小红书市场营销实习生，负责内容营销策划、社交媒体运营和品牌活动执行。",
  "requirements": [
    "市场营销、新闻传播、广告学等相关专业",
    "熟悉社交媒体平台运营",
    "具备良好的文案撰写能力",
    "有相关实习经验者优先"
  ],
  "skills": ["市场营销", "社交媒体运营", "内容策划", "文案撰写", "数据分析", "品牌推广"],
  "posted_date": "2026-04-07",
  "source": "boss",
  "url": "https://www.zhipin.com/job_detail/xxx",
  "status": "active"
}