{
  "id": "BOSS20240024",
  "title": "产品经理实习生",
  "company": "美团",
  "company_size": "2000人以上",
  "company_industry": "互联网/本地生活",
  "location": "北京",
  "job_type": "实习",
  "salary_min": 7000,
  "salary_max": 12000,
  "salary_months": 13,
  "education": "本科",
  "experience": "应届生",
  "description": "美团外卖产品团队招聘产品经理实习生，参与需求分析、产品设计和用户调研工作。",
  "requirements": [
    "市场营销、心理学、计算机等相关专业",
    "具备优秀的产品思维和用户同理心",
    "熟练使用Axure、Sketch等产品设计工具",
    "有产品实习经验者优先"
  ],
  "skills": ["产品设计", "用户调研", "需求分析", "Axure", "PRD", "数据分析", "项目管理"],
  "posted_date": "2026-04-08",
  "source": "boss",
  "url": "https://www.zhipin.com/job_detail/xxx",
  "status": "active"
}