{
  "id": "ZPIN20240002",
  "title": "前端开发实习生",
  "company": "腾讯科技",
  "company_size": "2000人以上",
  "company_industry": "互联网/游戏",
  "location": "深圳",
  "job_type": "实习",
  "salary_min": 5000,
  "salary_max": 8000,
  "salary_months": 14,
  "education": "本科",
  "experience": "应届生",
  "description": "腾讯微信事业群招聘前端开发实习生，参与微信小程序及Web应用开发。",
  "requirements": [
    "计算机相关专业",
    "熟悉HTML/CSS/JavaScript",
    "了解Vue.js或React框架",
    "有良好的编程习惯",
    "对技术有热情，学习能力强"
  ],
  "skills": ["JavaScript", "Vue.js", "HTML5", "CSS3", "TypeScript"],
  "posted_date": "2026-04-08",
  "deadline": "2026-05-31",
  "source": "zhaopin",
  "url": "https://www.zhaopin.com/job/xxx",
  "status": "active",
  "created_at": "2026-04-11T10:00:00Z",
  "updated_at": "2026-04-11T10:00:00Z"
}
